{"componentChunkName":"component---src-templates-math-js","path":"/math/","result":{"data":{"mdx":{"body":"function _extends() { _extends = Object.assign || function (target) { for (var i = 1; i < arguments.length; i++) { var source = arguments[i]; for (var key in source) { if (Object.prototype.hasOwnProperty.call(source, key)) { target[key] = source[key]; } } } return target; }; return _extends.apply(this, arguments); }\n\nfunction _objectWithoutProperties(source, excluded) { if (source == null) return {}; var target = _objectWithoutPropertiesLoose(source, excluded); var key, i; if (Object.getOwnPropertySymbols) { var sourceSymbolKeys = Object.getOwnPropertySymbols(source); for (i = 0; i < sourceSymbolKeys.length; i++) { key = sourceSymbolKeys[i]; if (excluded.indexOf(key) >= 0) continue; if (!Object.prototype.propertyIsEnumerable.call(source, key)) continue; target[key] = source[key]; } } return target; }\n\nfunction _objectWithoutPropertiesLoose(source, excluded) { if (source == null) return {}; var target = {}; var sourceKeys = Object.keys(source); var key, i; for (i = 0; i < sourceKeys.length; i++) { key = sourceKeys[i]; if (excluded.indexOf(key) >= 0) continue; target[key] = source[key]; } return target; }\n\n/* @jsx mdx */\nvar _frontmatter = {\n  \"date\": \"2018-01-23\",\n  \"title\": \"Hello Math\",\n  \"tags\": [\"math\", \"index\"],\n  \"excerpt\": \"新年新Math\"\n};\n\nvar makeShortcode = function makeShortcode(name) {\n  return function MDXDefaultShortcode(props) {\n    console.warn(\"Component \" + name + \" was not imported, exported, or provided by MDXProvider as global scope\");\n    return mdx(\"div\", props);\n  };\n};\n\nvar layoutProps = {\n  _frontmatter: _frontmatter\n};\nvar MDXLayout = \"wrapper\";\nreturn function MDXContent(_ref) {\n  var components = _ref.components,\n      props = _objectWithoutProperties(_ref, [\"components\"]);\n\n  return mdx(MDXLayout, _extends({}, layoutProps, props, {\n    components: components,\n    mdxType: \"MDXLayout\"\n  }), mdx(\"h1\", {\n    \"id\": \"Math-with-Katex\",\n    \"style\": {\n      \"position\": \"relative\"\n    }\n  }, \"Math with \", mdx(\"a\", {\n    parentName: \"h1\",\n    \"href\": \"https://katex.org/docs/supported.html\"\n  }, \"Katex\"), mdx(\"a\", {\n    parentName: \"h1\",\n    \"href\": \"#Math-with-Katex\",\n    \"aria-label\": \"Math with Katex permalink\",\n    \"className\": \"anchor after\"\n  }, mdx(\"svg\", {\n    parentName: \"a\",\n    \"aria-hidden\": \"true\",\n    \"focusable\": \"false\",\n    \"height\": \"16\",\n    \"version\": \"1.1\",\n    \"viewBox\": \"0 0 16 16\",\n    \"width\": \"16\"\n  }, mdx(\"path\", {\n    parentName: \"svg\",\n    \"fillRule\": \"evenodd\",\n    \"d\": \"M4 9h1v1H4c-1.5 0-3-1.69-3-3.5S2.55 3 4 3h4c1.45 0 3 1.69 3 3.5 0 1.41-.91 2.72-2 3.25V8.59c.58-.45 1-1.27 1-2.09C10 5.22 8.98 4 8 4H4c-.98 0-2 1.22-2 2.5S3 9 4 9zm9-3h-1v1h1c1 0 2 1.22 2 2.5S13.98 12 13 12H9c-.98 0-2-1.22-2-2.5 0-.83.42-1.64 1-2.09V6.25c-1.09.53-2 1.84-2 3.25C6 11.31 7.55 13 9 13h4c1.45 0 3-1.69 3-3.5S14.5 6 13 6z\"\n  })))), mdx(\"p\", null, mdx(\"span\", {\n    parentName: \"p\",\n    \"className\": \"katex\"\n  }, mdx(\"span\", {\n    parentName: \"span\",\n    \"className\": \"katex-mathml\"\n  }, mdx(\"math\", {\n    parentName: \"span\",\n    \"xmlns\": \"http://www.w3.org/1998/Math/MathML\"\n  }, mdx(\"semantics\", {\n    parentName: \"math\"\n  }, mdx(\"mrow\", {\n    parentName: \"semantics\"\n  }, mdx(\"msup\", {\n    parentName: \"mrow\"\n  }, mdx(\"mi\", {\n    parentName: \"msup\"\n  }, \"x\"), mdx(\"mn\", {\n    parentName: \"msup\"\n  }, \"2\")), mdx(\"mo\", {\n    parentName: \"mrow\"\n  }, \"+\"), mdx(\"msub\", {\n    parentName: \"mrow\"\n  }, mdx(\"mi\", {\n    parentName: \"msub\"\n  }, \"y\"), mdx(\"mn\", {\n    parentName: \"msub\"\n  }, \"1\")), mdx(\"mo\", {\n    parentName: \"mrow\"\n  }, \"=\"), mdx(\"mi\", {\n    parentName: \"mrow\"\n  }, \"\\u03C0\")), mdx(\"annotation\", {\n    parentName: \"semantics\",\n    \"encoding\": \"application/x-tex\"\n  }, \"x^2 + y_1 = \\\\pi\")))), mdx(\"span\", {\n    parentName: \"span\",\n    \"className\": \"katex-html\",\n    \"aria-hidden\": \"true\"\n  }, mdx(\"span\", {\n    parentName: \"span\",\n    \"className\": \"base\"\n  }, mdx(\"span\", {\n    parentName: \"span\",\n    \"className\": \"strut\",\n    \"style\": {\n      \"height\": \"0.897438em\",\n      \"verticalAlign\": \"-0.08333em\"\n    }\n  }), mdx(\"span\", {\n    parentName: \"span\",\n    \"className\": \"mord\"\n  }, mdx(\"span\", {\n    parentName: \"span\",\n    \"className\": \"mord mathdefault\"\n  }, \"x\"), mdx(\"span\", {\n    parentName: \"span\",\n    \"className\": \"msupsub\"\n  }, mdx(\"span\", {\n    parentName: \"span\",\n    \"className\": \"vlist-t\"\n  }, mdx(\"span\", {\n    parentName: \"span\",\n    \"className\": \"vlist-r\"\n  }, mdx(\"span\", {\n    parentName: \"span\",\n    \"className\": \"vlist\",\n    \"style\": {\n      \"height\": \"0.8141079999999999em\"\n    }\n  }, mdx(\"span\", {\n    parentName: \"span\",\n    \"style\": {\n      \"top\": \"-3.063em\",\n      \"marginRight\": \"0.05em\"\n    }\n  }, mdx(\"span\", {\n    parentName: \"span\",\n    \"className\": \"pstrut\",\n    \"style\": {\n      \"height\": \"2.7em\"\n    }\n  }), mdx(\"span\", {\n    parentName: \"span\",\n    \"className\": \"sizing reset-size6 size3 mtight\"\n  }, mdx(\"span\", {\n    parentName: \"span\",\n    \"className\": \"mord mtight\"\n  }, \"2\")))))))), mdx(\"span\", {\n    parentName: \"span\",\n    \"className\": \"mspace\",\n    \"style\": {\n      \"marginRight\": \"0.2222222222222222em\"\n    }\n  }), mdx(\"span\", {\n    parentName: \"span\",\n    \"className\": \"mbin\"\n  }, \"+\"), mdx(\"span\", {\n    parentName: \"span\",\n    \"className\": \"mspace\",\n    \"style\": {\n      \"marginRight\": \"0.2222222222222222em\"\n    }\n  })), mdx(\"span\", {\n    parentName: \"span\",\n    \"className\": \"base\"\n  }, mdx(\"span\", {\n    parentName: \"span\",\n    \"className\": \"strut\",\n    \"style\": {\n      \"height\": \"0.625em\",\n      \"verticalAlign\": \"-0.19444em\"\n    }\n  }), mdx(\"span\", {\n    parentName: \"span\",\n    \"className\": \"mord\"\n  }, mdx(\"span\", {\n    parentName: \"span\",\n    \"className\": \"mord mathdefault\",\n    \"style\": {\n      \"marginRight\": \"0.03588em\"\n    }\n  }, \"y\"), mdx(\"span\", {\n    parentName: \"span\",\n    \"className\": \"msupsub\"\n  }, mdx(\"span\", {\n    parentName: \"span\",\n    \"className\": \"vlist-t vlist-t2\"\n  }, mdx(\"span\", {\n    parentName: \"span\",\n    \"className\": \"vlist-r\"\n  }, mdx(\"span\", {\n    parentName: \"span\",\n    \"className\": \"vlist\",\n    \"style\": {\n      \"height\": \"0.30110799999999993em\"\n    }\n  }, mdx(\"span\", {\n    parentName: \"span\",\n    \"style\": {\n      \"top\": \"-2.5500000000000003em\",\n      \"marginLeft\": \"-0.03588em\",\n      \"marginRight\": \"0.05em\"\n    }\n  }, mdx(\"span\", {\n    parentName: \"span\",\n    \"className\": \"pstrut\",\n    \"style\": {\n      \"height\": \"2.7em\"\n    }\n  }), mdx(\"span\", {\n    parentName: \"span\",\n    \"className\": \"sizing reset-size6 size3 mtight\"\n  }, mdx(\"span\", {\n    parentName: \"span\",\n    \"className\": \"mord mtight\"\n  }, \"1\")))), mdx(\"span\", {\n    parentName: \"span\",\n    \"className\": \"vlist-s\"\n  }, \"\\u200B\")), mdx(\"span\", {\n    parentName: \"span\",\n    \"className\": \"vlist-r\"\n  }, mdx(\"span\", {\n    parentName: \"span\",\n    \"className\": \"vlist\",\n    \"style\": {\n      \"height\": \"0.15em\"\n    }\n  }, mdx(\"span\", {\n    parentName: \"span\"\n  })))))), mdx(\"span\", {\n    parentName: \"span\",\n    \"className\": \"mspace\",\n    \"style\": {\n      \"marginRight\": \"0.2777777777777778em\"\n    }\n  }), mdx(\"span\", {\n    parentName: \"span\",\n    \"className\": \"mrel\"\n  }, \"=\"), mdx(\"span\", {\n    parentName: \"span\",\n    \"className\": \"mspace\",\n    \"style\": {\n      \"marginRight\": \"0.2777777777777778em\"\n    }\n  })), mdx(\"span\", {\n    parentName: \"span\",\n    \"className\": \"base\"\n  }, mdx(\"span\", {\n    parentName: \"span\",\n    \"className\": \"strut\",\n    \"style\": {\n      \"height\": \"0.43056em\",\n      \"verticalAlign\": \"0em\"\n    }\n  }), mdx(\"span\", {\n    parentName: \"span\",\n    \"className\": \"mord mathdefault\",\n    \"style\": {\n      \"marginRight\": \"0.03588em\"\n    }\n  }, \"\\u03C0\")))), \" inline mode\"), mdx(\"h3\", {\n    \"id\": \"Scale-Matrix\",\n    \"style\": {\n      \"position\": \"relative\"\n    }\n  }, \"Scale Matrix\", mdx(\"a\", {\n    parentName: \"h3\",\n    \"href\": \"#Scale-Matrix\",\n    \"aria-label\": \"Scale Matrix permalink\",\n    \"className\": \"anchor after\"\n  }, mdx(\"svg\", {\n    parentName: \"a\",\n    \"aria-hidden\": \"true\",\n    \"focusable\": \"false\",\n    \"height\": \"16\",\n    \"version\": \"1.1\",\n    \"viewBox\": \"0 0 16 16\",\n    \"width\": \"16\"\n  }, mdx(\"path\", {\n    parentName: \"svg\",\n    \"fillRule\": \"evenodd\",\n    \"d\": \"M4 9h1v1H4c-1.5 0-3-1.69-3-3.5S2.55 3 4 3h4c1.45 0 3 1.69 3 3.5 0 1.41-.91 2.72-2 3.25V8.59c.58-.45 1-1.27 1-2.09C10 5.22 8.98 4 8 4H4c-.98 0-2 1.22-2 2.5S3 9 4 9zm9-3h-1v1h1c1 0 2 1.22 2 2.5S13.98 12 13 12H9c-.98 0-2-1.22-2-2.5 0-.83.42-1.64 1-2.09V6.25c-1.09.53-2 1.84-2 3.25C6 11.31 7.55 13 9 13h4c1.45 0 3-1.69 3-3.5S14.5 6 13 6z\"\n  })))), mdx(\"span\", {\n    \"className\": \"katex-display\"\n  }, mdx(\"span\", {\n    parentName: \"span\",\n    \"className\": \"katex\"\n  }, mdx(\"span\", {\n    parentName: \"span\",\n    \"className\": \"katex-mathml\"\n  }, mdx(\"math\", {\n    parentName: \"span\",\n    \"xmlns\": \"http://www.w3.org/1998/Math/MathML\"\n  }, mdx(\"semantics\", {\n    parentName: \"math\"\n  }, mdx(\"mrow\", {\n    parentName: \"semantics\"\n  }, mdx(\"mrow\", {\n    parentName: \"mrow\"\n  }, mdx(\"mo\", {\n    parentName: \"mrow\",\n    \"fence\": \"true\"\n  }, \"[\"), mdx(\"mfrac\", {\n    parentName: \"mrow\",\n    \"linethickness\": \"0px\"\n  }, mdx(\"msup\", {\n    parentName: \"mfrac\"\n  }, mdx(\"mi\", {\n    parentName: \"msup\"\n  }, \"x\"), mdx(\"mo\", {\n    parentName: \"msup\",\n    \"mathvariant\": \"normal\",\n    \"lspace\": \"0em\",\n    \"rspace\": \"0em\"\n  }, \"\\u2032\")), mdx(\"msup\", {\n    parentName: \"mfrac\"\n  }, mdx(\"mi\", {\n    parentName: \"msup\"\n  }, \"y\"), mdx(\"mo\", {\n    parentName: \"msup\",\n    \"mathvariant\": \"normal\",\n    \"lspace\": \"0em\",\n    \"rspace\": \"0em\"\n  }, \"\\u2032\"))), mdx(\"mo\", {\n    parentName: \"mrow\",\n    \"fence\": \"true\"\n  }, \"]\")), mdx(\"mo\", {\n    parentName: \"mrow\"\n  }, \"=\"), mdx(\"mrow\", {\n    parentName: \"mrow\"\n  }, mdx(\"mo\", {\n    parentName: \"mrow\",\n    \"fence\": \"true\"\n  }, \"[\"), mdx(\"mtable\", {\n    parentName: \"mrow\",\n    \"rowspacing\": \"0.15999999999999992em\",\n    \"columnspacing\": \"1em\"\n  }, mdx(\"mtr\", {\n    parentName: \"mtable\"\n  }, mdx(\"mtd\", {\n    parentName: \"mtr\"\n  }, mdx(\"mstyle\", {\n    parentName: \"mtd\",\n    \"scriptlevel\": \"0\",\n    \"displaystyle\": \"false\"\n  }, mdx(\"msub\", {\n    parentName: \"mstyle\"\n  }, mdx(\"mi\", {\n    parentName: \"msub\"\n  }, \"s\"), mdx(\"mi\", {\n    parentName: \"msub\"\n  }, \"x\")))), mdx(\"mtd\", {\n    parentName: \"mtr\"\n  }, mdx(\"mstyle\", {\n    parentName: \"mtd\",\n    \"scriptlevel\": \"0\",\n    \"displaystyle\": \"false\"\n  }, mdx(\"mn\", {\n    parentName: \"mstyle\"\n  }, \"0\")))), mdx(\"mtr\", {\n    parentName: \"mtable\"\n  }, mdx(\"mtd\", {\n    parentName: \"mtr\"\n  }, mdx(\"mstyle\", {\n    parentName: \"mtd\",\n    \"scriptlevel\": \"0\",\n    \"displaystyle\": \"false\"\n  }, mdx(\"mn\", {\n    parentName: \"mstyle\"\n  }, \"0\"))), mdx(\"mtd\", {\n    parentName: \"mtr\"\n  }, mdx(\"mstyle\", {\n    parentName: \"mtd\",\n    \"scriptlevel\": \"0\",\n    \"displaystyle\": \"false\"\n  }, mdx(\"msub\", {\n    parentName: \"mstyle\"\n  }, mdx(\"mi\", {\n    parentName: \"msub\"\n  }, \"s\"), mdx(\"mi\", {\n    parentName: \"msub\"\n  }, \"y\")))))), mdx(\"mo\", {\n    parentName: \"mrow\",\n    \"fence\": \"true\"\n  }, \"]\")), mdx(\"mrow\", {\n    parentName: \"mrow\"\n  }, mdx(\"mo\", {\n    parentName: \"mrow\",\n    \"fence\": \"true\"\n  }, \"[\"), mdx(\"mfrac\", {\n    parentName: \"mrow\",\n    \"linethickness\": \"0px\"\n  }, mdx(\"mi\", {\n    parentName: \"mfrac\"\n  }, \"x\"), mdx(\"mi\", {\n    parentName: \"mfrac\"\n  }, \"y\")), mdx(\"mo\", {\n    parentName: \"mrow\",\n    \"fence\": \"true\"\n  }, \"]\"))), mdx(\"annotation\", {\n    parentName: \"semantics\",\n    \"encoding\": \"application/x-tex\"\n  }, \"{x'\\\\brack y'} = \\\\begin{bmatrix}\\n   s_{x} & 0 \\\\\\\\\\n   0 & s_{y}\\n\\\\end{bmatrix}{x\\\\brack y}\")))), mdx(\"span\", {\n    parentName: \"span\",\n    \"className\": \"katex-html\",\n    \"aria-hidden\": \"true\"\n  }, mdx(\"span\", {\n    parentName: \"span\",\n    \"className\": \"base\"\n  }, mdx(\"span\", {\n    parentName: \"span\",\n    \"className\": \"strut\",\n    \"style\": {\n      \"height\": \"2.40003em\",\n      \"verticalAlign\": \"-0.95003em\"\n    }\n  }), mdx(\"span\", {\n    parentName: \"span\",\n    \"className\": \"mord\"\n  }, mdx(\"span\", {\n    parentName: \"span\",\n    \"className\": \"mord\"\n  }, mdx(\"span\", {\n    parentName: \"span\",\n    \"className\": \"mopen delimcenter\",\n    \"style\": {\n      \"top\": \"0em\"\n    }\n  }, mdx(\"span\", {\n    parentName: \"span\",\n    \"className\": \"delimsizing size3\"\n  }, \"[\")), mdx(\"span\", {\n    parentName: \"span\",\n    \"className\": \"mfrac\"\n  }, mdx(\"span\", {\n    parentName: \"span\",\n    \"className\": \"vlist-t vlist-t2\"\n  }, mdx(\"span\", {\n    parentName: \"span\",\n    \"className\": \"vlist-r\"\n  }, mdx(\"span\", {\n    parentName: \"span\",\n    \"className\": \"vlist\",\n    \"style\": {\n      \"height\": \"1.428892em\"\n    }\n  }, mdx(\"span\", {\n    parentName: \"span\",\n    \"style\": {\n      \"top\": \"-2.314em\"\n    }\n  }, mdx(\"span\", {\n    parentName: \"span\",\n    \"className\": \"pstrut\",\n    \"style\": {\n      \"height\": \"3em\"\n    }\n  }), mdx(\"span\", {\n    parentName: \"span\",\n    \"className\": \"mord\"\n  }, mdx(\"span\", {\n    parentName: \"span\",\n    \"className\": \"mord\"\n  }, mdx(\"span\", {\n    parentName: \"span\",\n    \"className\": \"mord mathdefault\",\n    \"style\": {\n      \"marginRight\": \"0.03588em\"\n    }\n  }, \"y\"), mdx(\"span\", {\n    parentName: \"span\",\n    \"className\": \"msupsub\"\n  }, mdx(\"span\", {\n    parentName: \"span\",\n    \"className\": \"vlist-t\"\n  }, mdx(\"span\", {\n    parentName: \"span\",\n    \"className\": \"vlist-r\"\n  }, mdx(\"span\", {\n    parentName: \"span\",\n    \"className\": \"vlist\",\n    \"style\": {\n      \"height\": \"0.6778919999999999em\"\n    }\n  }, mdx(\"span\", {\n    parentName: \"span\",\n    \"style\": {\n      \"top\": \"-2.9890000000000003em\",\n      \"marginRight\": \"0.05em\"\n    }\n  }, mdx(\"span\", {\n    parentName: \"span\",\n    \"className\": \"pstrut\",\n    \"style\": {\n      \"height\": \"2.7em\"\n    }\n  }), mdx(\"span\", {\n    parentName: \"span\",\n    \"className\": \"sizing reset-size6 size3 mtight\"\n  }, mdx(\"span\", {\n    parentName: \"span\",\n    \"className\": \"mord mtight\"\n  }, mdx(\"span\", {\n    parentName: \"span\",\n    \"className\": \"mord mtight\"\n  }, \"\\u2032\"))))))))))), mdx(\"span\", {\n    parentName: \"span\",\n    \"style\": {\n      \"top\": \"-3.677em\"\n    }\n  }, mdx(\"span\", {\n    parentName: \"span\",\n    \"className\": \"pstrut\",\n    \"style\": {\n      \"height\": \"3em\"\n    }\n  }), mdx(\"span\", {\n    parentName: \"span\",\n    \"className\": \"mord\"\n  }, mdx(\"span\", {\n    parentName: \"span\",\n    \"className\": \"mord\"\n  }, mdx(\"span\", {\n    parentName: \"span\",\n    \"className\": \"mord mathdefault\"\n  }, \"x\"), mdx(\"span\", {\n    parentName: \"span\",\n    \"className\": \"msupsub\"\n  }, mdx(\"span\", {\n    parentName: \"span\",\n    \"className\": \"vlist-t\"\n  }, mdx(\"span\", {\n    parentName: \"span\",\n    \"className\": \"vlist-r\"\n  }, mdx(\"span\", {\n    parentName: \"span\",\n    \"className\": \"vlist\",\n    \"style\": {\n      \"height\": \"0.751892em\"\n    }\n  }, mdx(\"span\", {\n    parentName: \"span\",\n    \"style\": {\n      \"top\": \"-3.063em\",\n      \"marginRight\": \"0.05em\"\n    }\n  }, mdx(\"span\", {\n    parentName: \"span\",\n    \"className\": \"pstrut\",\n    \"style\": {\n      \"height\": \"2.7em\"\n    }\n  }), mdx(\"span\", {\n    parentName: \"span\",\n    \"className\": \"sizing reset-size6 size3 mtight\"\n  }, mdx(\"span\", {\n    parentName: \"span\",\n    \"className\": \"mord mtight\"\n  }, mdx(\"span\", {\n    parentName: \"span\",\n    \"className\": \"mord mtight\"\n  }, \"\\u2032\")))))))))))), mdx(\"span\", {\n    parentName: \"span\",\n    \"className\": \"vlist-s\"\n  }, \"\\u200B\")), mdx(\"span\", {\n    parentName: \"span\",\n    \"className\": \"vlist-r\"\n  }, mdx(\"span\", {\n    parentName: \"span\",\n    \"className\": \"vlist\",\n    \"style\": {\n      \"height\": \"0.8804400000000001em\"\n    }\n  }, mdx(\"span\", {\n    parentName: \"span\"\n  }))))), mdx(\"span\", {\n    parentName: \"span\",\n    \"className\": \"mclose delimcenter\",\n    \"style\": {\n      \"top\": \"0em\"\n    }\n  }, mdx(\"span\", {\n    parentName: \"span\",\n    \"className\": \"delimsizing size3\"\n  }, \"]\")))), mdx(\"span\", {\n    parentName: \"span\",\n    \"className\": \"mspace\",\n    \"style\": {\n      \"marginRight\": \"0.2777777777777778em\"\n    }\n  }), mdx(\"span\", {\n    parentName: \"span\",\n    \"className\": \"mrel\"\n  }, \"=\"), mdx(\"span\", {\n    parentName: \"span\",\n    \"className\": \"mspace\",\n    \"style\": {\n      \"marginRight\": \"0.2777777777777778em\"\n    }\n  })), mdx(\"span\", {\n    parentName: \"span\",\n    \"className\": \"base\"\n  }, mdx(\"span\", {\n    parentName: \"span\",\n    \"className\": \"strut\",\n    \"style\": {\n      \"height\": \"2.40003em\",\n      \"verticalAlign\": \"-0.95003em\"\n    }\n  }), mdx(\"span\", {\n    parentName: \"span\",\n    \"className\": \"minner\"\n  }, mdx(\"span\", {\n    parentName: \"span\",\n    \"className\": \"mopen delimcenter\",\n    \"style\": {\n      \"top\": \"0em\"\n    }\n  }, mdx(\"span\", {\n    parentName: \"span\",\n    \"className\": \"delimsizing size3\"\n  }, \"[\")), mdx(\"span\", {\n    parentName: \"span\",\n    \"className\": \"mord\"\n  }, mdx(\"span\", {\n    parentName: \"span\",\n    \"className\": \"mtable\"\n  }, mdx(\"span\", {\n    parentName: \"span\",\n    \"className\": \"col-align-c\"\n  }, mdx(\"span\", {\n    parentName: \"span\",\n    \"className\": \"vlist-t vlist-t2\"\n  }, mdx(\"span\", {\n    parentName: \"span\",\n    \"className\": \"vlist-r\"\n  }, mdx(\"span\", {\n    parentName: \"span\",\n    \"className\": \"vlist\",\n    \"style\": {\n      \"height\": \"1.45em\"\n    }\n  }, mdx(\"span\", {\n    parentName: \"span\",\n    \"style\": {\n      \"top\": \"-3.61em\"\n    }\n  }, mdx(\"span\", {\n    parentName: \"span\",\n    \"className\": \"pstrut\",\n    \"style\": {\n      \"height\": \"3em\"\n    }\n  }), mdx(\"span\", {\n    parentName: \"span\",\n    \"className\": \"mord\"\n  }, mdx(\"span\", {\n    parentName: \"span\",\n    \"className\": \"mord\"\n  }, mdx(\"span\", {\n    parentName: \"span\",\n    \"className\": \"mord mathdefault\"\n  }, \"s\"), mdx(\"span\", {\n    parentName: \"span\",\n    \"className\": \"msupsub\"\n  }, mdx(\"span\", {\n    parentName: \"span\",\n    \"className\": \"vlist-t vlist-t2\"\n  }, mdx(\"span\", {\n    parentName: \"span\",\n    \"className\": \"vlist-r\"\n  }, mdx(\"span\", {\n    parentName: \"span\",\n    \"className\": \"vlist\",\n    \"style\": {\n      \"height\": \"0.151392em\"\n    }\n  }, mdx(\"span\", {\n    parentName: \"span\",\n    \"style\": {\n      \"top\": \"-2.5500000000000003em\",\n      \"marginLeft\": \"0em\",\n      \"marginRight\": \"0.05em\"\n    }\n  }, mdx(\"span\", {\n    parentName: \"span\",\n    \"className\": \"pstrut\",\n    \"style\": {\n      \"height\": \"2.7em\"\n    }\n  }), mdx(\"span\", {\n    parentName: \"span\",\n    \"className\": \"sizing reset-size6 size3 mtight\"\n  }, mdx(\"span\", {\n    parentName: \"span\",\n    \"className\": \"mord mtight\"\n  }, mdx(\"span\", {\n    parentName: \"span\",\n    \"className\": \"mord mathdefault mtight\"\n  }, \"x\"))))), mdx(\"span\", {\n    parentName: \"span\",\n    \"className\": \"vlist-s\"\n  }, \"\\u200B\")), mdx(\"span\", {\n    parentName: \"span\",\n    \"className\": \"vlist-r\"\n  }, mdx(\"span\", {\n    parentName: \"span\",\n    \"className\": \"vlist\",\n    \"style\": {\n      \"height\": \"0.15em\"\n    }\n  }, mdx(\"span\", {\n    parentName: \"span\"\n  })))))))), mdx(\"span\", {\n    parentName: \"span\",\n    \"style\": {\n      \"top\": \"-2.4099999999999997em\"\n    }\n  }, mdx(\"span\", {\n    parentName: \"span\",\n    \"className\": \"pstrut\",\n    \"style\": {\n      \"height\": \"3em\"\n    }\n  }), mdx(\"span\", {\n    parentName: \"span\",\n    \"className\": \"mord\"\n  }, mdx(\"span\", {\n    parentName: \"span\",\n    \"className\": \"mord\"\n  }, \"0\")))), mdx(\"span\", {\n    parentName: \"span\",\n    \"className\": \"vlist-s\"\n  }, \"\\u200B\")), mdx(\"span\", {\n    parentName: \"span\",\n    \"className\": \"vlist-r\"\n  }, mdx(\"span\", {\n    parentName: \"span\",\n    \"className\": \"vlist\",\n    \"style\": {\n      \"height\": \"0.9500000000000004em\"\n    }\n  }, mdx(\"span\", {\n    parentName: \"span\"\n  }))))), mdx(\"span\", {\n    parentName: \"span\",\n    \"className\": \"arraycolsep\",\n    \"style\": {\n      \"width\": \"0.5em\"\n    }\n  }), mdx(\"span\", {\n    parentName: \"span\",\n    \"className\": \"arraycolsep\",\n    \"style\": {\n      \"width\": \"0.5em\"\n    }\n  }), mdx(\"span\", {\n    parentName: \"span\",\n    \"className\": \"col-align-c\"\n  }, mdx(\"span\", {\n    parentName: \"span\",\n    \"className\": \"vlist-t vlist-t2\"\n  }, mdx(\"span\", {\n    parentName: \"span\",\n    \"className\": \"vlist-r\"\n  }, mdx(\"span\", {\n    parentName: \"span\",\n    \"className\": \"vlist\",\n    \"style\": {\n      \"height\": \"1.45em\"\n    }\n  }, mdx(\"span\", {\n    parentName: \"span\",\n    \"style\": {\n      \"top\": \"-3.61em\"\n    }\n  }, mdx(\"span\", {\n    parentName: \"span\",\n    \"className\": \"pstrut\",\n    \"style\": {\n      \"height\": \"3em\"\n    }\n  }), mdx(\"span\", {\n    parentName: \"span\",\n    \"className\": \"mord\"\n  }, mdx(\"span\", {\n    parentName: \"span\",\n    \"className\": \"mord\"\n  }, \"0\"))), mdx(\"span\", {\n    parentName: \"span\",\n    \"style\": {\n      \"top\": \"-2.4099999999999997em\"\n    }\n  }, mdx(\"span\", {\n    parentName: \"span\",\n    \"className\": \"pstrut\",\n    \"style\": {\n      \"height\": \"3em\"\n    }\n  }), mdx(\"span\", {\n    parentName: \"span\",\n    \"className\": \"mord\"\n  }, mdx(\"span\", {\n    parentName: \"span\",\n    \"className\": \"mord\"\n  }, mdx(\"span\", {\n    parentName: \"span\",\n    \"className\": \"mord mathdefault\"\n  }, \"s\"), mdx(\"span\", {\n    parentName: \"span\",\n    \"className\": \"msupsub\"\n  }, mdx(\"span\", {\n    parentName: \"span\",\n    \"className\": \"vlist-t vlist-t2\"\n  }, mdx(\"span\", {\n    parentName: \"span\",\n    \"className\": \"vlist-r\"\n  }, mdx(\"span\", {\n    parentName: \"span\",\n    \"className\": \"vlist\",\n    \"style\": {\n      \"height\": \"0.15139200000000003em\"\n    }\n  }, mdx(\"span\", {\n    parentName: \"span\",\n    \"style\": {\n      \"top\": \"-2.5500000000000003em\",\n      \"marginLeft\": \"0em\",\n      \"marginRight\": \"0.05em\"\n    }\n  }, mdx(\"span\", {\n    parentName: \"span\",\n    \"className\": \"pstrut\",\n    \"style\": {\n      \"height\": \"2.7em\"\n    }\n  }), mdx(\"span\", {\n    parentName: \"span\",\n    \"className\": \"sizing reset-size6 size3 mtight\"\n  }, mdx(\"span\", {\n    parentName: \"span\",\n    \"className\": \"mord mtight\"\n  }, mdx(\"span\", {\n    parentName: \"span\",\n    \"className\": \"mord mathdefault mtight\",\n    \"style\": {\n      \"marginRight\": \"0.03588em\"\n    }\n  }, \"y\"))))), mdx(\"span\", {\n    parentName: \"span\",\n    \"className\": \"vlist-s\"\n  }, \"\\u200B\")), mdx(\"span\", {\n    parentName: \"span\",\n    \"className\": \"vlist-r\"\n  }, mdx(\"span\", {\n    parentName: \"span\",\n    \"className\": \"vlist\",\n    \"style\": {\n      \"height\": \"0.286108em\"\n    }\n  }, mdx(\"span\", {\n    parentName: \"span\"\n  }))))))))), mdx(\"span\", {\n    parentName: \"span\",\n    \"className\": \"vlist-s\"\n  }, \"\\u200B\")), mdx(\"span\", {\n    parentName: \"span\",\n    \"className\": \"vlist-r\"\n  }, mdx(\"span\", {\n    parentName: \"span\",\n    \"className\": \"vlist\",\n    \"style\": {\n      \"height\": \"0.9500000000000004em\"\n    }\n  }, mdx(\"span\", {\n    parentName: \"span\"\n  }))))))), mdx(\"span\", {\n    parentName: \"span\",\n    \"className\": \"mclose delimcenter\",\n    \"style\": {\n      \"top\": \"0em\"\n    }\n  }, mdx(\"span\", {\n    parentName: \"span\",\n    \"className\": \"delimsizing size3\"\n  }, \"]\"))), mdx(\"span\", {\n    parentName: \"span\",\n    \"className\": \"mspace\",\n    \"style\": {\n      \"marginRight\": \"0.16666666666666666em\"\n    }\n  }), mdx(\"span\", {\n    parentName: \"span\",\n    \"className\": \"mord\"\n  }, mdx(\"span\", {\n    parentName: \"span\",\n    \"className\": \"mord\"\n  }, mdx(\"span\", {\n    parentName: \"span\",\n    \"className\": \"mopen delimcenter\",\n    \"style\": {\n      \"top\": \"0em\"\n    }\n  }, mdx(\"span\", {\n    parentName: \"span\",\n    \"className\": \"delimsizing size3\"\n  }, \"[\")), mdx(\"span\", {\n    parentName: \"span\",\n    \"className\": \"mfrac\"\n  }, mdx(\"span\", {\n    parentName: \"span\",\n    \"className\": \"vlist-t vlist-t2\"\n  }, mdx(\"span\", {\n    parentName: \"span\",\n    \"className\": \"vlist-r\"\n  }, mdx(\"span\", {\n    parentName: \"span\",\n    \"className\": \"vlist\",\n    \"style\": {\n      \"height\": \"1.10756em\"\n    }\n  }, mdx(\"span\", {\n    parentName: \"span\",\n    \"style\": {\n      \"top\": \"-2.314em\"\n    }\n  }, mdx(\"span\", {\n    parentName: \"span\",\n    \"className\": \"pstrut\",\n    \"style\": {\n      \"height\": \"3em\"\n    }\n  }), mdx(\"span\", {\n    parentName: \"span\",\n    \"className\": \"mord\"\n  }, mdx(\"span\", {\n    parentName: \"span\",\n    \"className\": \"mord mathdefault\",\n    \"style\": {\n      \"marginRight\": \"0.03588em\"\n    }\n  }, \"y\"))), mdx(\"span\", {\n    parentName: \"span\",\n    \"style\": {\n      \"top\": \"-3.677em\"\n    }\n  }, mdx(\"span\", {\n    parentName: \"span\",\n    \"className\": \"pstrut\",\n    \"style\": {\n      \"height\": \"3em\"\n    }\n  }), mdx(\"span\", {\n    parentName: \"span\",\n    \"className\": \"mord\"\n  }, mdx(\"span\", {\n    parentName: \"span\",\n    \"className\": \"mord mathdefault\"\n  }, \"x\")))), mdx(\"span\", {\n    parentName: \"span\",\n    \"className\": \"vlist-s\"\n  }, \"\\u200B\")), mdx(\"span\", {\n    parentName: \"span\",\n    \"className\": \"vlist-r\"\n  }, mdx(\"span\", {\n    parentName: \"span\",\n    \"className\": \"vlist\",\n    \"style\": {\n      \"height\": \"0.8804400000000001em\"\n    }\n  }, mdx(\"span\", {\n    parentName: \"span\"\n  }))))), mdx(\"span\", {\n    parentName: \"span\",\n    \"className\": \"mclose delimcenter\",\n    \"style\": {\n      \"top\": \"0em\"\n    }\n  }, mdx(\"span\", {\n    parentName: \"span\",\n    \"className\": \"delimsizing size3\"\n  }, \"]\")))))))));\n}\n;\nMDXContent.isMDXComponent = true;","frontmatter":{"date":"2018-01-23","title":"Hello Math"},"fields":{"slug":"/math","templateTag":"math"}}},"pageContext":{"frontmatter":{"date":"2018-01-23","title":"Hello Math","tags":["math","index"],"excerpt":"新年新Math"},"title":"Hello Math","date":"2018-01-23","slug":"/math","genByTemplate":"math"}},"staticQueryHashes":["3649515864","49750724","63159454"]}