{"pageProps":{"post":{"matter":{"title":"加密保存的游戏数据","tags":["archive"],"type":"docs.godotengine.org","avatar":"https://docs.godotengine.org/zh_CN/stable/_static/docs_logo.png","reference":"Godot（4月1日）|https://docs.godotengine.org/zh_CN/stable/tutorials/io/encrypting_save_games.html#","ignoredDepth":[1]},"absPath":"/home/runner/work/blog/blog/renderer/mdx/archive/encryptingSaveGames.mdx","type":"mdx","slug":["encryptingSaveGames"],"collection":"archive","url":"/archive/encryptingSaveGames"},"compiled":{"content":"/*@jsxRuntime automatic @jsxImportSource react*/\nconst {Fragment: _Fragment, jsx: _jsx, jsxs: _jsxs} = arguments[0];\nconst title = \"加密保存的游戏数据\", tags = [\"archive\"], type = \"docs.godotengine.org\", avatar = \"https://docs.godotengine.org/zh_CN/stable/_static/docs_logo.png\", reference = \"Godot（4月1日）|https://docs.godotengine.org/zh_CN/stable/tutorials/io/encrypting_save_games.html#\", ignoredDepth = [1];\nfunction _createMdxContent(props) {\n  const _components = Object.assign({\n    ul: \"ul\",\n    li: \"li\",\n    hr: \"hr\",\n    h1: \"h1\",\n    a: \"a\",\n    svg: \"svg\",\n    path: \"path\",\n    h2: \"h2\",\n    p: \"p\",\n    pre: \"pre\",\n    code: \"code\",\n    span: \"span\",\n    blockquote: \"blockquote\"\n  }, props.components);\n  return _jsxs(_Fragment, {\n    children: [_jsx(\"input\", {\n      id: \"gd\",\n      name: \"la\",\n      type: \"radio\",\n      checked: true,\n      readOnly: true\n    }), \"\\n\", _jsx(\"input\", {\n      id: \"cs\",\n      name: \"la\",\n      type: \"radio\",\n      readOnly: true\n    }), \"\\n\", _jsx(\"div\", {\n      className: \"navgator\",\n      children: _jsxs(_components.ul, {\n        children: [\"\\n\", _jsx(_components.li, {\n          children: \"Docs »\"\n        }), \"\\n\", _jsx(_components.li, {\n          children: \"I/O »\"\n        }), \"\\n\", _jsx(_components.li, {\n          children: \"Encrypting save games\"\n        }), \"\\n\", _jsx(_components.li, {\n          children: \"View page source\"\n        }), \"\\n\"]\n      })\n    }), \"\\n\", _jsx(_components.hr, {}), \"\\n\", _jsxs(_components.h1, {\n      id: \"encrypting-save-games\",\n      children: [\"Encrypting save games\", _jsx(_components.a, {\n        className: \"anchor after\",\n        \"aria-hidden\": true,\n        \"aria-label\": \"permalink\",\n        tabIndex: \"-1\",\n        href: \"#encrypting-save-games\",\n        children: _jsx(_components.svg, {\n          xmlns: \"http://www.w3.org/2000/svg\",\n          width: \"16\",\n          height: \"16\",\n          viewBox: \"0 0 16 16\",\n          focusable: \"false\",\n          children: _jsx(_components.path, {\n            d: \"M4 9h1v1H4c-1.5 0-3-1.69-3-3.5S2.55 3 4 3h4c1.45 0 3 1.69 3 3.5 0 1.41-.91 2.72-2 3.25V8.59c.58-.45 1-1.27 1-2.09C10 5.22 8.98 4 8 4H4c-.98 0-2 1.22-2 2.5S3 9 4 9zm9-3h-1v1h1c1 0 2 1.22 2 2.5S13.98 12 13 12H9c-.98 0-2-1.22-2-2.5 0-.83.42-1.64 1-2.09V6.25c-1.09.53-2 1.84-2 3.25C6 11.31 7.55 13 9 13h4c1.45 0 3-1.69 3-3.5S14.5 6 13 6z\",\n            fillRule: \"evenodd\"\n          })\n        })\n      })]\n    }), \"\\n\", _jsxs(_components.h2, {\n      id: \"why\",\n      children: [\"Why?\", _jsx(_components.a, {\n        className: \"anchor after\",\n        \"aria-hidden\": true,\n        \"aria-label\": \"permalink\",\n        tabIndex: \"-1\",\n        href: \"#why\",\n        children: _jsx(_components.svg, {\n          xmlns: \"http://www.w3.org/2000/svg\",\n          width: \"16\",\n          height: \"16\",\n          viewBox: \"0 0 16 16\",\n          focusable: \"false\",\n          children: _jsx(_components.path, {\n            d: \"M4 9h1v1H4c-1.5 0-3-1.69-3-3.5S2.55 3 4 3h4c1.45 0 3 1.69 3 3.5 0 1.41-.91 2.72-2 3.25V8.59c.58-.45 1-1.27 1-2.09C10 5.22 8.98 4 8 4H4c-.98 0-2 1.22-2 2.5S3 9 4 9zm9-3h-1v1h1c1 0 2 1.22 2 2.5S13.98 12 13 12H9c-.98 0-2-1.22-2-2.5 0-.83.42-1.64 1-2.09V6.25c-1.09.53-2 1.84-2 3.25C6 11.31 7.55 13 9 13h4c1.45 0 3-1.69 3-3.5S14.5 6 13 6z\",\n            fillRule: \"evenodd\"\n          })\n        })\n      })]\n    }), \"\\n\", _jsx(_components.p, {\n      children: \"Because the world today is not the world of yesterday. A capitalist oligarchy runs the world and forces us to consume in order to keep the gears of this rotten society on track. As such, the biggest market for video game consumption today is the mobile one. It is a market of poor souls forced to compulsively consume digital content in order to forget the misery of their everyday life, commute, or just any other brief free moment they have that they are not using to produce goods or services for the ruling class. These individuals need to keep focusing on their video games (because not doing so will fill them with tremendous existential angst), so they go as far as spending money on them to extend their experience, and their preferred way of doing so is through in-app purchases and virtual currency.\"\n    }), \"\\n\", _jsx(_components.p, {\n      children: \"But what if someone were to find a way to edit the saved games and assign the items and currency without effort? That would be terrible, because it would help players consume the content much faster, and therefore run out of it sooner than expected. If that happens, they will have nothing that prevents them from thinking, and the tremendous agony of realizing their own irrelevance would again take over their life.\"\n    }), \"\\n\", _jsx(_components.p, {\n      children: \"No, we definitely do not want that to happen, so let's see how to encrypt savegames and protect the world order.\"\n    }), \"\\n\", _jsxs(_components.h2, {\n      id: \"how\",\n      children: [\"How?\", _jsx(_components.a, {\n        className: \"anchor after\",\n        \"aria-hidden\": true,\n        \"aria-label\": \"permalink\",\n        tabIndex: \"-1\",\n        href: \"#how\",\n        children: _jsx(_components.svg, {\n          xmlns: \"http://www.w3.org/2000/svg\",\n          width: \"16\",\n          height: \"16\",\n          viewBox: \"0 0 16 16\",\n          focusable: \"false\",\n          children: _jsx(_components.path, {\n            d: \"M4 9h1v1H4c-1.5 0-3-1.69-3-3.5S2.55 3 4 3h4c1.45 0 3 1.69 3 3.5 0 1.41-.91 2.72-2 3.25V8.59c.58-.45 1-1.27 1-2.09C10 5.22 8.98 4 8 4H4c-.98 0-2 1.22-2 2.5S3 9 4 9zm9-3h-1v1h1c1 0 2 1.22 2 2.5S13.98 12 13 12H9c-.98 0-2-1.22-2-2.5 0-.83.42-1.64 1-2.09V6.25c-1.09.53-2 1.84-2 3.25C6 11.31 7.55 13 9 13h4c1.45 0 3-1.69 3-3.5S14.5 6 13 6z\",\n            fillRule: \"evenodd\"\n          })\n        })\n      })]\n    }), \"\\n\", _jsxs(_components.p, {\n      children: [\"The class \", _jsx(_components.a, {\n        href: \"#\",\n        children: \"File\"\n      }), \" can open a file at a location and read/write data (integers, strings and variants). It also supports encryption. To create an encrypted file, a passphrase must be provided, like this:\"]\n    }), \"\\n\", _jsxs(\"div\", {\n      className: \"sphinx-tabs\",\n      children: [_jsxs(\"div\", {\n        children: [_jsx(\"label\", {\n          htmlFor: \"gd\",\n          children: \"GDScript\"\n        }), _jsx(\"label\", {\n          htmlFor: \"cs\",\n          children: \"C#\"\n        })]\n      }), _jsx(_components.pre, {\n        className: \"language-py\",\n        children: _jsxs(_components.code, {\n          className: \"language-py code-highlight\",\n          children: [_jsxs(_components.span, {\n            className: \"code-line\",\n            children: [\"var f \", _jsx(_components.span, {\n              className: \"token operator\",\n              children: \"=\"\n            }), \" File\", _jsx(_components.span, {\n              className: \"token punctuation\",\n              children: \".\"\n            }), \"new\", _jsx(_components.span, {\n              className: \"token punctuation\",\n              children: \"(\"\n            }), _jsx(_components.span, {\n              className: \"token punctuation\",\n              children: \")\"\n            }), \"\\n\"]\n          }), _jsxs(_components.span, {\n            className: \"code-line\",\n            children: [\"var err \", _jsx(_components.span, {\n              className: \"token operator\",\n              children: \"=\"\n            }), \" f\", _jsx(_components.span, {\n              className: \"token punctuation\",\n              children: \".\"\n            }), \"open_encrypted_with_pass\", _jsx(_components.span, {\n              className: \"token punctuation\",\n              children: \"(\"\n            }), _jsx(_components.span, {\n              className: \"token string\",\n              children: \"\\\"user://savedata.bin\\\"\"\n            }), _jsx(_components.span, {\n              className: \"token punctuation\",\n              children: \",\"\n            }), \" File\", _jsx(_components.span, {\n              className: \"token punctuation\",\n              children: \".\"\n            }), \"WRITE\", _jsx(_components.span, {\n              className: \"token punctuation\",\n              children: \",\"\n            }), \" \", _jsx(_components.span, {\n              className: \"token string\",\n              children: \"\\\"mypass\\\"\"\n            }), _jsx(_components.span, {\n              className: \"token punctuation\",\n              children: \")\"\n            }), \"\\n\"]\n          }), _jsxs(_components.span, {\n            className: \"code-line\",\n            children: [\"f\", _jsx(_components.span, {\n              className: \"token punctuation\",\n              children: \".\"\n            }), \"store_var\", _jsx(_components.span, {\n              className: \"token punctuation\",\n              children: \"(\"\n            }), \"game_state\", _jsx(_components.span, {\n              className: \"token punctuation\",\n              children: \")\"\n            }), \"\\n\"]\n          }), _jsxs(_components.span, {\n            className: \"code-line\",\n            children: [\"f\", _jsx(_components.span, {\n              className: \"token punctuation\",\n              children: \".\"\n            }), \"close\", _jsx(_components.span, {\n              className: \"token punctuation\",\n              children: \"(\"\n            }), _jsx(_components.span, {\n              className: \"token punctuation\",\n              children: \")\"\n            }), \"\\n\"]\n          })]\n        })\n      }), _jsx(_components.pre, {\n        className: \"language-csharp\",\n        children: _jsxs(_components.code, {\n          className: \"language-csharp code-highlight\",\n          children: [_jsxs(_components.span, {\n            className: \"code-line\",\n            children: [_jsx(_components.span, {\n              className: \"token class-name\",\n              children: _jsx(_components.span, {\n                className: \"token keyword\",\n                children: \"var\"\n              })\n            }), \" f \", _jsx(_components.span, {\n              className: \"token operator\",\n              children: \"=\"\n            }), \" \", _jsx(_components.span, {\n              className: \"token keyword\",\n              children: \"new\"\n            }), \" \", _jsx(_components.span, {\n              className: \"token constructor-invocation class-name\",\n              children: \"File\"\n            }), _jsx(_components.span, {\n              className: \"token punctuation\",\n              children: \"(\"\n            }), _jsx(_components.span, {\n              className: \"token punctuation\",\n              children: \")\"\n            }), _jsx(_components.span, {\n              className: \"token punctuation\",\n              children: \";\"\n            }), \"\\n\"]\n          }), _jsxs(_components.span, {\n            className: \"code-line\",\n            children: [_jsx(_components.span, {\n              className: \"token class-name\",\n              children: _jsx(_components.span, {\n                className: \"token keyword\",\n                children: \"var\"\n              })\n            }), \" err \", _jsx(_components.span, {\n              className: \"token operator\",\n              children: \"=\"\n            }), \" f\", _jsx(_components.span, {\n              className: \"token punctuation\",\n              children: \".\"\n            }), _jsx(_components.span, {\n              className: \"token function\",\n              children: \"OpenEncryptedWithPass\"\n            }), _jsx(_components.span, {\n              className: \"token punctuation\",\n              children: \"(\"\n            }), _jsx(_components.span, {\n              className: \"token string\",\n              children: \"\\\"user://savedata.bin\\\"\"\n            }), _jsx(_components.span, {\n              className: \"token punctuation\",\n              children: \",\"\n            }), \" \", _jsx(_components.span, {\n              className: \"token punctuation\",\n              children: \"(\"\n            }), _jsx(_components.span, {\n              className: \"token keyword\",\n              children: \"int\"\n            }), _jsx(_components.span, {\n              className: \"token punctuation\",\n              children: \")\"\n            }), \"File\", _jsx(_components.span, {\n              className: \"token punctuation\",\n              children: \".\"\n            }), \"ModeFlags\", _jsx(_components.span, {\n              className: \"token punctuation\",\n              children: \".\"\n            }), \"Write\", _jsx(_components.span, {\n              className: \"token punctuation\",\n              children: \",\"\n            }), \" \", _jsx(_components.span, {\n              className: \"token string\",\n              children: \"\\\"mypass\\\"\"\n            }), _jsx(_components.span, {\n              className: \"token punctuation\",\n              children: \")\"\n            }), _jsx(_components.span, {\n              className: \"token punctuation\",\n              children: \";\"\n            }), \"\\n\"]\n          }), _jsxs(_components.span, {\n            className: \"code-line\",\n            children: [\"f\", _jsx(_components.span, {\n              className: \"token punctuation\",\n              children: \".\"\n            }), _jsx(_components.span, {\n              className: \"token function\",\n              children: \"StoreVar\"\n            }), _jsx(_components.span, {\n              className: \"token punctuation\",\n              children: \"(\"\n            }), \"gameState\", _jsx(_components.span, {\n              className: \"token punctuation\",\n              children: \")\"\n            }), _jsx(_components.span, {\n              className: \"token punctuation\",\n              children: \";\"\n            }), \"\\n\"]\n          }), _jsxs(_components.span, {\n            className: \"code-line\",\n            children: [\"f\", _jsx(_components.span, {\n              className: \"token punctuation\",\n              children: \".\"\n            }), _jsx(_components.span, {\n              className: \"token function\",\n              children: \"Close\"\n            }), _jsx(_components.span, {\n              className: \"token punctuation\",\n              children: \"(\"\n            }), _jsx(_components.span, {\n              className: \"token punctuation\",\n              children: \")\"\n            }), _jsx(_components.span, {\n              className: \"token punctuation\",\n              children: \";\"\n            }), \"\\n\"]\n          })]\n        })\n      })]\n    }), \"\\n\", _jsx(_components.p, {\n      children: \"This will make the file unreadable to users, but will still not prevent them from sharing savefiles. To solve this, use the device unique id or some unique user identifier, for example:\"\n    }), \"\\n\", _jsxs(\"div\", {\n      className: \"sphinx-tabs\",\n      children: [_jsxs(\"div\", {\n        children: [_jsx(\"label\", {\n          htmlFor: \"gd\",\n          children: \"GDScript\"\n        }), _jsx(\"label\", {\n          htmlFor: \"cs\",\n          children: \"C#\"\n        })]\n      }), _jsx(_components.pre, {\n        className: \"language-py\",\n        children: _jsxs(_components.code, {\n          className: \"language-py code-highlight\",\n          children: [_jsxs(_components.span, {\n            className: \"code-line\",\n            children: [\"var f \", _jsx(_components.span, {\n              className: \"token operator\",\n              children: \"=\"\n            }), \" File\", _jsx(_components.span, {\n              className: \"token punctuation\",\n              children: \".\"\n            }), \"new\", _jsx(_components.span, {\n              className: \"token punctuation\",\n              children: \"(\"\n            }), _jsx(_components.span, {\n              className: \"token punctuation\",\n              children: \")\"\n            }), \"\\n\"]\n          }), _jsxs(_components.span, {\n            className: \"code-line\",\n            children: [\"var err \", _jsx(_components.span, {\n              className: \"token operator\",\n              children: \"=\"\n            }), \" f\", _jsx(_components.span, {\n              className: \"token punctuation\",\n              children: \".\"\n            }), \"open_encrypted_with_pass\", _jsx(_components.span, {\n              className: \"token punctuation\",\n              children: \"(\"\n            }), _jsx(_components.span, {\n              className: \"token string\",\n              children: \"\\\"user://savedata.bin\\\"\"\n            }), _jsx(_components.span, {\n              className: \"token punctuation\",\n              children: \",\"\n            }), \" File\", _jsx(_components.span, {\n              className: \"token punctuation\",\n              children: \".\"\n            }), \"WRITE\", _jsx(_components.span, {\n              className: \"token punctuation\",\n              children: \",\"\n            }), \" OS\", _jsx(_components.span, {\n              className: \"token punctuation\",\n              children: \".\"\n            }), \"get_unique_id\", _jsx(_components.span, {\n              className: \"token punctuation\",\n              children: \"(\"\n            }), _jsx(_components.span, {\n              className: \"token punctuation\",\n              children: \")\"\n            }), _jsx(_components.span, {\n              className: \"token punctuation\",\n              children: \")\"\n            }), \"\\n\"]\n          }), _jsxs(_components.span, {\n            className: \"code-line\",\n            children: [\"f\", _jsx(_components.span, {\n              className: \"token punctuation\",\n              children: \".\"\n            }), \"store_var\", _jsx(_components.span, {\n              className: \"token punctuation\",\n              children: \"(\"\n            }), \"game_state\", _jsx(_components.span, {\n              className: \"token punctuation\",\n              children: \")\"\n            }), \"\\n\"]\n          }), _jsxs(_components.span, {\n            className: \"code-line\",\n            children: [\"f\", _jsx(_components.span, {\n              className: \"token punctuation\",\n              children: \".\"\n            }), \"close\", _jsx(_components.span, {\n              className: \"token punctuation\",\n              children: \"(\"\n            }), _jsx(_components.span, {\n              className: \"token punctuation\",\n              children: \")\"\n            }), \"\\n\"]\n          })]\n        })\n      }), _jsx(_components.pre, {\n        className: \"language-csharp\",\n        children: _jsxs(_components.code, {\n          className: \"language-csharp code-highlight\",\n          children: [_jsxs(_components.span, {\n            className: \"code-line\",\n            children: [_jsx(_components.span, {\n              className: \"token class-name\",\n              children: _jsx(_components.span, {\n                className: \"token keyword\",\n                children: \"var\"\n              })\n            }), \" f \", _jsx(_components.span, {\n              className: \"token operator\",\n              children: \"=\"\n            }), \" \", _jsx(_components.span, {\n              className: \"token keyword\",\n              children: \"new\"\n            }), \" \", _jsx(_components.span, {\n              className: \"token constructor-invocation class-name\",\n              children: \"File\"\n            }), _jsx(_components.span, {\n              className: \"token punctuation\",\n              children: \"(\"\n            }), _jsx(_components.span, {\n              className: \"token punctuation\",\n              children: \")\"\n            }), _jsx(_components.span, {\n              className: \"token punctuation\",\n              children: \";\"\n            }), \"\\n\"]\n          }), _jsxs(_components.span, {\n            className: \"code-line\",\n            children: [_jsx(_components.span, {\n              className: \"token class-name\",\n              children: _jsx(_components.span, {\n                className: \"token keyword\",\n                children: \"var\"\n              })\n            }), \" err \", _jsx(_components.span, {\n              className: \"token operator\",\n              children: \"=\"\n            }), \" f\", _jsx(_components.span, {\n              className: \"token punctuation\",\n              children: \".\"\n            }), _jsx(_components.span, {\n              className: \"token function\",\n              children: \"OpenEncryptedWithPass\"\n            }), _jsx(_components.span, {\n              className: \"token punctuation\",\n              children: \"(\"\n            }), _jsx(_components.span, {\n              className: \"token string\",\n              children: \"\\\"user://savedata.bin\\\"\"\n            }), _jsx(_components.span, {\n              className: \"token punctuation\",\n              children: \",\"\n            }), \" \", _jsx(_components.span, {\n              className: \"token punctuation\",\n              children: \"(\"\n            }), _jsx(_components.span, {\n              className: \"token keyword\",\n              children: \"int\"\n            }), _jsx(_components.span, {\n              className: \"token punctuation\",\n              children: \")\"\n            }), \"File\", _jsx(_components.span, {\n              className: \"token punctuation\",\n              children: \".\"\n            }), \"ModeFlags\", _jsx(_components.span, {\n              className: \"token punctuation\",\n              children: \".\"\n            }), \"Write\", _jsx(_components.span, {\n              className: \"token punctuation\",\n              children: \",\"\n            }), \" OS\", _jsx(_components.span, {\n              className: \"token punctuation\",\n              children: \".\"\n            }), _jsx(_components.span, {\n              className: \"token function\",\n              children: \"GetUniqueId\"\n            }), _jsx(_components.span, {\n              className: \"token punctuation\",\n              children: \"(\"\n            }), _jsx(_components.span, {\n              className: \"token punctuation\",\n              children: \")\"\n            }), _jsx(_components.span, {\n              className: \"token punctuation\",\n              children: \")\"\n            }), _jsx(_components.span, {\n              className: \"token punctuation\",\n              children: \";\"\n            }), \"\\n\"]\n          }), _jsxs(_components.span, {\n            className: \"code-line\",\n            children: [\"f\", _jsx(_components.span, {\n              className: \"token punctuation\",\n              children: \".\"\n            }), _jsx(_components.span, {\n              className: \"token function\",\n              children: \"StoreVar\"\n            }), _jsx(_components.span, {\n              className: \"token punctuation\",\n              children: \"(\"\n            }), \"gameState\", _jsx(_components.span, {\n              className: \"token punctuation\",\n              children: \")\"\n            }), _jsx(_components.span, {\n              className: \"token punctuation\",\n              children: \";\"\n            }), \"\\n\"]\n          }), _jsxs(_components.span, {\n            className: \"code-line\",\n            children: [\"f\", _jsx(_components.span, {\n              className: \"token punctuation\",\n              children: \".\"\n            }), _jsx(_components.span, {\n              className: \"token function\",\n              children: \"Close\"\n            }), _jsx(_components.span, {\n              className: \"token punctuation\",\n              children: \"(\"\n            }), _jsx(_components.span, {\n              className: \"token punctuation\",\n              children: \")\"\n            }), _jsx(_components.span, {\n              className: \"token punctuation\",\n              children: \";\"\n            }), \"\\n\"]\n          })]\n        })\n      })]\n    }), \"\\n\", _jsxs(_components.p, {\n      children: [\"Note that \", _jsx(_components.code, {\n        children: \"OS.get_unique_id()\"\n      }), \" does not work on UWP or HTML5.\"]\n    }), \"\\n\", _jsx(_components.p, {\n      children: \"That is all! Thank you for your cooperation, citizen.\"\n    }), \"\\n\", _jsxs(_components.blockquote, {\n      children: [\"\\n\", _jsx(_components.p, {\n        children: \"This method cannot really prevent players from editing their savegames locally because, since the encryption key is stored inside the game, the player can still decrypt and edit the file themselves. The only way to prevent this from being possible is to store the save data on a remote server, where players can only make authorized changes to their save data. If your game deals with real money, you need to be doing this anyway.\"\n      }), \"\\n\"]\n    })]\n  });\n}\nfunction MDXContent(props = {}) {\n  const {wrapper: MDXLayout} = props.components || ({});\n  return MDXLayout ? _jsx(MDXLayout, Object.assign({}, props, {\n    children: _jsx(_createMdxContent, props)\n  })) : _createMdxContent(props);\n}\nreturn {\n  title,\n  tags,\n  type,\n  avatar,\n  reference,\n  ignoredDepth,\n  default: MDXContent\n};\n","toc":[{"depth":1,"value":"Encrypting save games","id":"encrypting-save-games","children":[{"depth":2,"value":"Why?","id":"why"},{"depth":2,"value":"How?","id":"how"}]}]},"overview":[{"length":20,"name":"archive"},{"length":15,"name":"graphics"},{"length":1,"name":"math"},{"length":8,"name":"network"}]},"__N_SSG":true}